MOVE_ID,TYPE_ID,CATEGORY_ID,MOVE_NAME,MOVER_PWR,MOVE_ACC,MOVE_PP,MOVE_EFFECT,MOVE_EF_PROB
727,14,1,Synchronoise,120,100,10,Hits any Pokémon that shares a type with the user.,
728,9,2,Synthesis,,,5,User recovers HP. Amount varies with the weather.,
729,12,0,Tackle,40,100,35,,
730,0,2,Tail Glow,,,20,Drastically raises user's Special Attack.,
731,12,0,Tail Slap,25,85,10,Hits 2-5 times in one turn.,
732,12,2,Tail Whip,,100,30,Lowers opponent's Defense.,
733,7,2,Tailwind,,,15,Doubles Speed for 4 turns.,
734,12,0,Take Down,90,85,20,User receives recoil damage.,
735,14,2,Take Heart,,,10,Heals user's status conditions and raises its stats.,
736,15,2,Tar Shot,,100,15,Lowers the opponent's Speed and makes them weaker to Fire-type moves.,100
737,1,2,Taunt,,100,20,Opponent can only use moves that attack.,
738,12,2,Tearful Look,,,20,The user gets teary eyed to make the target lose its combative spirit. This lowers the target's Attack and Sp. Atk stats.,100
739,12,2,Teatime,,,10,Forces all Pokémon on the field to eat their berries.,
740,12,1,Techno Blast,120,100,5,Type depends on the Drive being held.,
741,12,2,Teeter Dance,,100,20,Confuses all Pokémon.,
742,14,2,Telekinesis,,,15,"Ignores opponent's Evasiveness for three turns, add Ground immunity.",
743,14,2,Teleport,,,20,Allows user to flee wild battles; also warps player to last PokéCenter.,
744,12,1,Tera Blast,80,100,10,Changes type when the user has Terastallized.,
745,12,1,Terrain Pulse,50,100,10,Type and power change depending on the Terrain in effect.,
746,1,0,Thief,60,100,25,Also steals opponent's held item.,
747,10,0,Thousand Arrows,90,100,10,Makes Flying-type Pokémon vulnerable to Ground moves.,
748,10,0,Thousand Waves,90,100,10,Opponent cannot flee or switch.,
749,12,0,Thrash,120,100,10,User attacks for 2-3 turns but then becomes confused.,
750,1,0,Throat Chop,80,100,15,Prevents use of sound moves for two turns.,100
751,3,1,Thunder,110,70,10,May paralyze opponent.,30
752,3,1,Thunder Cage,80,90,15,"Deals damage and traps opponent, damaging them for 4-5 turns.",
753,3,0,Thunder Fang,65,95,15,May cause flinching and/or paralyze opponent.,10
754,3,0,Thunder Punch,75,100,15,May paralyze opponent.,10
755,3,1,Thunder Shock,40,100,30,May paralyze opponent.,10
756,3,2,Thunder Wave,,90,20,Paralyzes opponent.,
757,3,1,Thunderbolt,90,100,15,May paralyze opponent.,10
758,5,0,Thunderous Kick,90,100,10,Lowers opponent's Defense.,100
759,12,2,Tickle,,100,20,Lowers opponent's Attack and Defense.,
760,12,2,Tidy Up,,,10,"Removes the effects of entry hazards and Substitute, and boosts user’s Attack and Speed.",
761,1,2,Topsy-Turvy,,,20,Reverses stat changes of opponent.,
762,6,1,Torch Song,80,100,10,Raises user's Special Attack.,
763,1,2,Torment,,100,15,Opponent cannot use the same move in a row.,
764,13,2,Toxic,,90,10,Badly poisons opponent.,
765,13,2,Toxic Spikes,,,20,Poisons opponents when they switch into battle.,
766,13,2,Toxic Thread,,100,20,Poisons opponent and lowers its Speed.,100
767,9,0,Trailblaze,50,100,20,Raises user's Speed.,
768,12,2,Transform,,,10,User takes on the form and attacks of the opponent.,
769,12,1,Tri Attack,80,100,10,"May paralyze, burn or freeze opponent.",20
770,14,2,Trick,,100,10,Swaps held items with the opponent.,
771,14,2,Trick Room,,,5,Slower Pokémon move first in the turn for 5 turns.,
772,8,2,Trick-or-Treat,,100,20,Adds Ghost type to opponent.,
773,5,0,Triple Arrows,90,100,10,Raises critical hit ratio and lowers target's Defense.,
774,11,0,Triple Axel,20,90,10,Attacks thrice with more power each time.,
775,17,0,Triple Dive,30,95,10,Hits 3 times in a row.,
776,5,0,Triple Kick,10,90,10,Hits thrice in one turn at increasing power.,
777,9,0,Trop Kick,70,100,15,Lowers opponent's Attack.,100
778,12,1,Trump Card,,,5,"The lower the PP, the higher the power.",
779,14,1,Twin Beam,40,100,10,Hits twice in one turn.,
780,0,0,Twineedle,25,100,20,Hits twice in one turn. May poison opponent.,20
781,2,1,Twister,40,100,20,May cause flinching. Hits Pokémon using Fly/Bounce with double power.,20
782,0,0,U-turn,70,100,20,User switches out immediately after attacking.,
783,12,1,Uproar,90,100,10,User attacks for 3 turns and prevents sleep.,
784,6,0,V-create,180,95,5,"Lowers user's Defense, Special Defense and Speed.",100
785,5,1,Vacuum Wave,40,100,30,User attacks first.,
786,12,0,Veevee Volley,,,20,Power increases when player's bond is stronger.,
787,13,2,Venom Drench,,100,20,Lowers poisoned opponent's Special Attack and Speed.,100
788,13,1,Venoshock,65,100,10,Inflicts double damage if the target is poisoned.,
789,5,2,Victory Dance,,,10,Raises Attack and Defense.,
790,9,0,Vine Whip,45,100,25,,
791,12,0,Vise Grip,55,100,30,,
792,5,0,Vital Throw,70,,10,"User attacks last, but ignores Accuracy and Evasiveness.",
793,3,1,Volt Switch,70,100,20,User must switch out after attacking.,
794,3,0,Volt Tackle,120,100,15,User receives recoil damage. May paralyze opponent.,10
795,5,0,Wake-Up Slap,70,100,10,"Power doubles if opponent is asleep, but wakes it up.",
796,17,1,Water Gun,40,100,25,,
797,17,1,Water Pledge,80,100,10,Added effects appear if preceded by Fire Pledge or succeeded by Grass Pledge.,
798,17,1,Water Pulse,60,100,20,May confuse opponent.,20
799,17,1,Water Shuriken,15,100,20,Hits 2-5 times in one turn.,
800,17,2,Water Sport,,,15,Weakens the power of Fire-type moves.,
801,17,1,Water Spout,150,100,5,"The higher the user's HP, the higher the damage caused.",
802,17,0,Waterfall,80,100,15,May cause flinching.,20
803,17,0,Wave Crash,120,100,10,User receives recoil damage.,
804,12,1,Weather Ball,50,100,10,Move's power and type changes with the weather.,
805,17,1,Whirlpool,35,85,15,"Traps opponent, damaging them for 4-5 turns.",100
806,12,2,Whirlwind,,,20,"In battles, the opponent switches. In the wild, the Pokémon runs.",
807,1,0,Wicked Blow,75,100,5,Always results in a critical hit and ignores stat changes.,
808,1,0,Wicked Torque,80,100,10,,
809,15,2,Wide Guard,,,10,Protects the user's team from multi-target attacks.,
810,3,0,Wild Charge,90,100,15,User receives recoil damage.,
811,3,1,Wildbolt Storm,100,80,10,May paralyze target.,
812,6,2,Will-O-Wisp,,85,15,Burns opponent.,
813,7,0,Wing Attack,60,100,35,,
814,12,2,Wish,,,10,The user recovers HP in the following turn.,
815,17,2,Withdraw,,,40,Raises user's Defense.,
816,14,2,Wonder Room,,,10,Swaps every Pokémon's Defense and Special Defense for 5 turns.,
817,9,0,Wood Hammer,120,100,15,User receives recoil damage.,
818,12,2,Work Up,,,30,Raises user's Attack and Special Attack.,
819,9,2,Worry Seed,,100,10,Changes the opponent's Ability to Insomnia.,
820,12,0,Wrap,15,90,20,"Traps opponent, damaging them for 4-5 turns.",100
821,12,1,Wring Out,,100,5,"The higher the opponent's HP, the higher the damage.",
822,0,0,X-Scissor,80,100,15,,
823,12,2,Yawn,,,10,Puts opponent to sleep in the next turn.,
824,3,1,Zap Cannon,120,50,5,Paralyzes opponent.,100
825,14,0,Zen Headbutt,80,90,15,May cause flinching.,20
826,3,0,Zing Zap,80,100,10,May cause flinching.,30
827,3,0,Zippy Zap,50,100,15,Always results in a critical hit.,100
