MOVE_ID,TYPE_ID,CATEGORY_ID,MOVE_NAME,MOVER_PWR,MOVE_ACC,MOVE_PP,MOVE_EFFECT,MOVE_EF_PROB
363,6,1,Inferno,100,50,5,Burns opponent.,100
364,0,1,Infestation,20,100,20,"Traps opponent, damaging them for 4-5 turns.",100
365,9,2,Ingrain,,,20,User restores HP each turn. User cannot escape/switch.,
366,14,2,Instruct,,,15,Allows an ally to use a move instead.,
367,3,2,Ion Deluge,,,25,Changes Normal-type moves to Electric-type.,
368,16,2,Iron Defense,,,15,Sharply raises user's Defense.,
369,16,0,Iron Head,80,100,15,May cause flinching.,30
370,16,0,Iron Tail,100,75,15,May lower opponent's Defense.,30
371,1,0,Jaw Lock,80,100,10,Prevents user and opponent from switching out.,
372,17,0,Jet Punch,60,100,15,Always goes first.,
373,12,1,Judgment,100,100,10,Type depends on the Arceus Plate being held.,
374,5,0,Jump Kick,100,95,10,"If it misses, the user loses half their HP.",
375,9,2,Jungle Healing,,,10,Restores team's HP and cures status conditions.,
376,5,0,Karate Chop,50,100,25,High critical hit ratio.,
377,14,2,Kinesis,,80,15,Lowers opponent's Accuracy.,
378,16,2,King's Shield,,,10,Protects the user and lowers opponent's Attack on contact.,
379,1,0,Knock Off,65,100,20,Removes opponent's held item for the rest of the battle.,
380,1,0,Kowtow Cleave,85,,10,Always hits.,
381,10,0,Land's Wrath,90,100,10,,
382,12,2,Laser Focus,,,30,User's next attack is guaranteed to result in a critical hit.,
383,1,0,Lash Out,75,100,5,Double power if stats were lowered during the turn.,
384,12,0,Last Resort,140,100,5,Can only be used after all other moves are used.,
385,8,0,Last Respects,50,100,10,Damages increases the more party Pokémon have been defeated.,
386,6,1,Lava Plume,80,100,15,May burn opponent.,30
387,9,0,Leaf Blade,90,100,15,High critical hit ratio.,
388,9,1,Leaf Storm,130,90,5,Sharply lowers user's Special Attack.,100
389,9,1,Leaf Tornado,65,90,10,May lower opponent's Accuracy.,50
390,9,0,Leafage,40,100,40,Strikes opponent with leaves.,
391,0,0,Leech Life,80,100,10,User recovers half the HP inflicted on opponent.,
392,9,2,Leech Seed,,90,10,Drains HP from opponent each turn.,
393,12,2,Leer,,100,30,Lowers opponent's Defense.,100
394,8,0,Lick,30,100,30,May paralyze opponent.,30
395,17,2,Life Dew,,,10,User and teammates recover HP.,
396,4,1,Light of Ruin,140,90,5,User receives recoil damage.,
397,14,2,Light Screen,,,30,Halves damage from Special attacks for 5 turns.,
398,17,0,Liquidation,85,100,10,May lower opponent's Defense.,20
399,12,2,Lock-On,,,5,User's next attack is guaranteed to hit.,
400,12,2,Lovely Kiss,,75,10,Puts opponent to sleep.,
401,5,0,Low Kick,,100,20,"The heavier the opponent, the stronger the attack.",
402,5,0,Low Sweep,65,100,20,Lowers opponent's Speed.,100
403,12,2,Lucky Chant,,,30,Opponent cannot land critical hits for 5 turns.,
404,14,1,Lumina Crash,80,100,10,Harshly lowers target’s Special Defense.,
405,14,2,Lunar Blessing,,,5,Heals user's status conditions and recovers HP.,
406,14,2,Lunar Dance,,,10,The user faints but the next Pokémon released is fully healed.,
407,0,0,Lunge,80,100,15,"The user makes a lunge at the target, attacking with full force. This also lowers the target's Attack stat.",100
408,14,1,Luster Purge,70,100,5,May lower opponent's Special Defense.,50
409,5,0,Mach Punch,40,100,30,User attacks first.,
410,14,2,Magic Coat,,,15,Reflects moves that cause status conditions back to the attacker.,
411,14,2,Magic Powder,,100,20,Changes target's type to Psychic.,
412,14,2,Magic Room,,,10,Suppresses the effects of held items for five turns.,
413,9,1,Magical Leaf,60,,20,Ignores Accuracy and Evasiveness.,
414,4,0,Magical Torque,100,100,10,,
415,6,1,Magma Storm,100,75,5,"Traps opponent, damaging them for 4-5 turns.",100
416,16,0,Magnet Bomb,60,,20,Ignores Accuracy and Evasiveness.,
417,3,2,Magnet Rise,,,10,User becomes immune to Ground-type moves for 5 turns.,
418,3,2,Magnetic Flux,,,20,Raises Defense and Sp. Defense of Plus/Minus Pokémon.,
419,10,0,Magnitude,,100,30,Hits with random power.,
420,16,1,Make It Rain,120,100,5,Lowers user's Special Attack. Money is earned after the battle.,
421,5,2,Mat Block,,,10,Protects teammates from damaging moves.,
422,12,2,Me First,,,20,User copies the opponent's attack with 1.5× power.,
423,12,2,Mean Look,,,5,Opponent cannot flee or switch.,
424,14,2,Meditate,,,40,Raises user's Attack.,
425,9,1,Mega Drain,40,100,15,User recovers half the HP inflicted on opponent.,
426,12,0,Mega Kick,120,75,5,,
427,12,0,Mega Punch,80,85,20,,
428,0,0,Megahorn,120,85,10,,
429,1,2,Memento,,100,10,"User faints, sharply lowers opponent's Attack and Special Attack.",
430,16,0,Metal Burst,,100,10,Deals damage equal to 1.5x opponent's attack.,
431,16,0,Metal Claw,50,95,35,May raise user's Attack.,10
432,16,2,Metal Sound,,85,40,Sharply lowers opponent's Special Defense.,
433,5,0,Meteor Assault,150,100,5,User must recharge next turn.,
434,15,1,Meteor Beam,120,90,10,"User gathers space power and boosts its Sp. Atk stat, then attacks the target on the next turn.",
435,16,0,Meteor Mash,90,90,10,May raise user's Attack.,20
436,12,2,Metronome,,,10,User performs almost any move in the game at random.,
437,12,2,Milk Drink,,,5,User recovers half its max HP.,
438,12,2,Mimic,,,10,Copies the opponent's last move.,
439,6,1,Mind Blown,150,100,5,User receives recoil damage.,
440,12,2,Mind Reader,,,5,User's next attack is guaranteed to hit.,
441,12,2,Minimize,,,10,Sharply raises user's Evasiveness.,
442,14,2,Miracle Eye,,,40,"Resets opponent's Evasiveness, removes Dark's Psychic immunity.",
443,14,1,Mirror Coat,,100,20,"When hit by a Special Attack, user strikes back with 2x power.",
444,7,2,Mirror Move,,,20,User performs the opponent's last move.,
445,16,1,Mirror Shot,65,85,10,May lower opponent's Accuracy.,30
446,11,2,Mist,,,30,User's stats cannot be changed for a period of time.,
447,14,1,Mist Ball,70,100,5,May lower opponent's Special Attack.,50
448,4,1,Misty Explosion,100,100,5,Power increases on Misty Terrain.,
449,4,2,Misty Terrain,,,10,Protects the field from status conditions for 5 turns.,
450,4,1,Moonblast,95,100,15,May lower opponent's Special Attack.,30
451,8,1,Moongeist Beam,100,100,5,Ignores the target's ability.,
452,4,2,Moonlight,,,5,User recovers HP. Amount varies with the weather.,
453,12,2,Morning Sun,,,5,User recovers HP. Amount varies with the weather.,
454,13,0,Mortal Spin,30,100,15,"Removes entry hazards and trap move effects, and poisons opposing Pokémon.",
455,11,0,Mountain Gale,100,85,10,Lowers user's Speed.,
456,10,1,Mud Bomb,65,85,10,May lower opponent's Accuracy.,30
457,10,1,Mud Shot,55,95,15,Lowers opponent's Speed.,100
458,10,2,Mud Sport,,,15,Weakens the power of Electric-type moves.,
459,10,1,Mud-Slap,20,100,10,Lowers opponent's Accuracy.,100
460,17,1,Muddy Water,90,85,10,May lower opponent's Accuracy.,30
461,12,0,Multi-Attack,120,100,10,Type matches Memory item held.,
462,6,1,Mystical Fire,75,100,10,Lowers opponent's Special Attack.,100
463,14,1,Mystical Power,70,90,10,Raises user's Attack or Defense.,
464,1,2,Nasty Plot,,,20,Sharply raises user's Special Attack.,
465,12,0,Natural Gift,,100,15,Power and type depend on the user's held berry.,
466,12,2,Nature Power,,,20,Uses a certain move based on the current terrain.,
467,4,1,Nature's Madness,,90,10,Halves the foe's HP.,
468,9,0,Needle Arm,60,100,15,May cause flinching.,30
469,1,1,Night Daze,85,95,10,May lower opponent's Accuracy.,40
470,8,1,Night Shade,,100,15,Inflicts damage equal to user's level.,
471,1,0,Night Slash,70,100,15,High critical hit ratio.,
472,8,2,Nightmare,,100,15,The sleeping opponent loses 25% of its max HP each turn.,
473,5,2,No Retreat,,,5,Raises all stats but user cannot switch out.,100
474,12,2,Noble Roar,,100,30,Lowers opponent's Attack and Special Attack.,100
475,13,0,Noxious Torque,100,100,10,,
476,3,0,Nuzzle,20,100,20,Paralyzes opponent.,100
477,7,1,Oblivion Wing,80,100,10,User recovers most of the HP inflicted on opponent.,
478,1,2,Obstruct,,100,10,Protects the user and sharply lowers Defence on contact.,
479,17,1,Octazooka,65,85,10,May lower opponent's Accuracy.,50
480,5,2,Octolock,,100,15,"Lowers opponent's Defense and Special Defense every turn, and they cannot flee or switch out.",
481,12,2,Odor Sleuth,,,40,"Resets opponent's Evasiveness, and allows Normal- and Fighting-type attacks to hit Ghosts.",
482,8,1,Ominous Wind,60,100,5,May raise all user's stats at once.,10
483,2,0,Order Up,80,100,10,,
484,17,1,Origin Pulse,110,85,10,Hits all adjacent opponents.,
485,2,0,Outrage,120,100,10,User attacks for 2-3 turns but then becomes confused.,
486,3,1,Overdrive,80,100,10,Hits all adjacent opponents.,
487,6,1,Overheat,130,90,5,Sharply lowers user's Special Attack.,100
488,12,2,Pain Split,,,20,The user's and opponent's HP becomes the average of both.,
489,3,1,Parabolic Charge,65,100,20,User recovers half the HP inflicted on opponent.,
490,1,2,Parting Shot,,100,20,Lowers opponent's Attack and Special Attack then switches out. ,100
491,12,0,Pay Day,40,100,20,Money is earned after the battle.,
492,1,0,Payback,50,100,10,Power doubles if the user was attacked first.,
493,7,0,Peck,35,100,35,,
494,12,2,Perish Song,,,5,Any Pokémon in play when this attack is used faints in 3 turns.,
495,9,0,Petal Blizzard,90,100,15,Hits all adjacent Pokémon.,
496,9,1,Petal Dance,120,100,10,User attacks for 2-3 turns but then becomes confused.,
497,8,0,Phantom Force,90,100,10,"Disappears on first turn, attacks on second. Can strike through Protect/Detect.",
498,14,1,Photon Geyser,100,100,5,"Uses Attack or Special Attack stat, whichever is higher.",
499,3,1,Pika Papow,,,20,Power increases when player's bond is stronger.,
500,0,0,Pin Missile,25,95,20,Hits 2-5 times in one turn.,
501,3,0,Plasma Fists,100,100,15,Changes Normal-type moves to Electric-type moves.,
502,12,2,Play Nice,,,20,Lowers opponent's Attack. Always hits.,100
503,4,0,Play Rough,90,90,10,May lower opponent's Attack.,10
504,7,0,Pluck,60,100,20,"If the opponent is holding a berry, its effect is stolen by user.",
505,13,0,Poison Fang,50,100,15,May badly poison opponent.,50
506,13,2,Poison Gas,,90,40,Poisons opponent.,
507,13,0,Poison Jab,80,100,20,May poison the opponent.,30
508,13,2,Poison Powder,,75,35,Poisons opponent.,
509,13,0,Poison Sting,15,100,35,May poison the opponent.,30
510,13,0,Poison Tail,50,100,25,High critical hit ratio. May poison opponent.,10
511,0,1,Pollen Puff,90,100,15,Deals damage to opponent or restores HP of teammate.,
512,8,0,Poltergeist,110,90,5,Fails if the target doesn’t have an item.,
513,12,0,Population Bomb,20,90,10,Hits 1-10 times in a row.,
514,0,0,Pounce,50,100,20,Lowers opponent's Speed.,100
515,12,0,Pound,40,100,35,,
516,0,2,Powder,,100,20,Damages Pokémon using Fire type moves.,
517,11,1,Powder Snow,40,100,25,May freeze opponent.,10
518,15,1,Power Gem,80,100,20,,
519,12,2,Power Shift,,,10,Switches offensive and defensive stats.,
520,14,2,Power Split,,,10,Averages Attack and Special Attack with the target.,
521,14,2,Power Swap,,,10,User and opponent swap Attack and Special Attack.,
522,14,2,Power Trick,,,10,User's own Attack and Defense switch.,
523,1,0,Power Trip,20,100,10,"The user boasts its strength and attacks the target. The more the user's stats are raised, the greater the move's power.",
524,9,0,Power Whip,120,85,10,,
525,5,0,Power-Up Punch,40,100,20,Raises Attack.,100
526,10,0,Precipice Blades,120,85,10,Hits all adjacent opponents.,
527,12,0,Present,,90,15,Either deals damage or heals.,
528,14,1,Prismatic Laser,160,100,10,The user shoots powerful lasers using the power of a prism. The user can't move on the next turn.,
529,12,2,Protect,,,10,"Protects the user, but may fail if used consecutively.",
530,14,1,Psybeam,65,100,20,May confuse opponent.,10
531,14,0,Psyblade,80,100,15,Power increases on Electric Terrain.,
532,12,2,Psych Up,,,10,Copies the opponent's stat changes.,
533,14,1,14,90,100,10,May lower opponent's Special Defense.,10
534,14,0,Psychic Fangs,85,100,10,The user bites the target with its psychic capabilities. This can also destroy Light Screen and Reflect.,
535,14,2,Psychic Terrain,,,10,Prevents priority moves from being used for 5 turns.,
536,14,1,Psycho Boost,140,90,5,Sharply lowers user's Special Attack.,100
537,14,0,Psycho Cut,70,100,20,High critical hit ratio.,
538,14,2,Psycho Shift,,100,10,Transfers user's status condition to the opponent.,
539,14,0,Psyshield Bash,70,90,10,Raises user's Defense and Special Defense.,
540,14,1,Psyshock,80,100,10,"Inflicts damage based on the target's Defense, not Special Defense.",
541,14,1,Psystrike,100,100,10,"Inflicts damage based on the target's Defense, not Special Defense.",
542,14,1,Psywave,,100,15,Inflicts damage 50-150% of user's level.,
543,1,0,Punishment,,100,5,Power increases when opponent's stats have been raised.,
544,13,2,Purify,,,20,"The user heals the target's status condition. If the move succeeds, it also restores the user's own HP.",
545,1,0,Pursuit,40,100,20,Double power if the opponent is switching out.,
546,6,0,Pyro Ball,120,90,5,May burn opponent.,10
547,1,2,Quash,,100,15,Makes the target act last this turn.,
548,12,0,Quick Attack,40,100,30,User attacks first.,
549,5,2,Quick Guard,,,15,Protects the user's team from high-priority moves.,
550,0,2,Quiver Dance,,,20,"Raises user's Special Attack, Special Defense and Speed.",
551,12,0,Rage,20,100,20,Raises user's Attack when hit.,
552,8,0,Rage Fist,50,100,10,"The more times the user has been hit by attacks, the greater the move's power.",
553,0,2,Rage Powder,,,20,"Forces attacks to hit user, not team-mates.",
554,12,0,Raging Bull,90,100,10,Type depends on the user’s form. Breaks through Reflect and Light Screen barriers.,
555,6,0,Raging Fury,120,100,10,User keeps repeating the same move over and over.,
556,17,2,Rain Dance,,,5,Makes it rain for 5 turns.,
557,12,0,Rapid Spin,50,100,40,Raises user's Speed and removes entry hazards and trap move effects.,100
558,9,0,Razor Leaf,55,95,25,High critical hit ratio.,
559,17,0,Razor Shell,75,95,10,May lower opponent's Defense.,50
560,12,1,Razor Wind,80,100,10,"Charges on first turn, attacks on second. High critical hit ratio.",
561,12,2,Recover,,,5,User recovers half its max HP.,
562,12,2,Recycle,,,10,User's used hold item is restored.,
563,14,2,Reflect,,,20,Halves damage from Physical attacks for 5 turns.,
564,12,2,Reflect Type,,,15,User becomes the target's type.,
565,12,2,Refresh,,,20,"Cures paralysis, poison, and burns.",
566,12,1,Relic Song,75,100,10,May put the target to sleep.,10
567,14,2,Rest,,,5,"User sleeps for 2 turns, but user is fully healed.",
568,12,0,Retaliate,70,100,5,Inflicts double damage if a teammate fainted on the last turn.,
569,12,0,Return,,100,20,Power increases with higher Friendship.,
570,12,1,Revelation Dance,90,100,15,Type changes based on Oricorio's form.,
571,5,0,Revenge,60,100,10,Power increases if user was hit first.,
572,5,0,Reversal,,100,15,"The lower the user's HP, the higher the power.",
573,12,2,Revival Blessing,,,1,Revives a fainted party Pokémon to half HP.,
574,3,1,Rising Voltage,70,100,20,Power doubles on Electric Terrain.,
575,12,2,Roar,,,20,"In battles, the opponent switches. In the wild, the Pokémon runs.",
576,2,1,Roar of Time,150,90,5,User must recharge next turn.,
577,15,0,Rock Blast,25,90,10,Hits 2-5 times in one turn.,
578,12,0,Rock Climb,90,85,20,May confuse opponent.,20
579,15,2,Rock Polish,,,20,Sharply raises user's Speed.,
580,15,0,Rock Slide,75,90,10,May cause flinching.,30
581,5,0,Rock Smash,40,100,15,May lower opponent's Defense.,50
582,15,0,Rock Throw,50,90,15,,
583,15,0,Rock Tomb,60,95,15,Lowers opponent's Speed.,100
584,15,0,Rock Wrecker,150,90,5,User must recharge next turn.,
585,14,2,Role Play,,,10,User copies the opponent's Ability.,
586,5,0,Rolling Kick,60,85,15,May cause flinching.,30
587,15,0,Rollout,30,90,20,Doubles in power each turn for 5 turns.,
588,7,2,Roost,,,5,User recovers half of its max HP and loses the Flying type temporarily.,
589,10,2,Rototiller,,,10,Raises Attack and Special Attack of Grass-types.,100
590,12,1,Round,60,100,15,Power increases if teammates use it in the same turn.,
591,1,1,Ruination,1,90,10,Halves the opponent's HP.,
592,6,0,Sacred Fire,100,95,5,May burn opponent.,50
593,5,0,Sacred Sword,90,100,15,Ignores opponent's stat changes.,
594,12,2,Safeguard,,,25,The user's party is protected from status conditions.,
595,15,0,Salt Cure,40,100,15,Deals damage each turn; Steel and Water types are more affected.,
596,10,2,Sand Attack,,100,15,Lowers opponent's Accuracy.,
597,10,0,Sand Tomb,35,85,15,"Traps opponent, damaging them for 4-5 turns.",100
598,10,1,Sandsear Storm,100,80,10,May burn target.,
599,15,2,Sandstorm,,,10,Creates a sandstorm for 5 turns.,
600,9,0,Sappy Seed,90,100,15,Drains HP from opponent each turn.,100
601,17,1,Scald,80,100,15,May burn opponent.,30
602,2,0,Scale Shot,25,90,20,Hits 2-5 times in one turn. Boosts user's Speed but lowers its Defense.,
603,12,2,Scary Face,,100,10,Sharply lowers opponent's Speed.,
604,10,1,Scorching Sands,70,100,10,May burn the target.,
605,12,0,Scratch,40,100,35,,
606,12,2,Screech,,85,40,Sharply lowers opponent's Defense.,
607,6,1,Searing Shot,100,100,5,May burn opponent.,30
608,12,0,Secret Power,70,100,20,Effects of the attack vary with the location.,30
609,5,1,Secret Sword,85,100,10,"Inflicts damage based on the target's Defense, not Special Defense.",
610,9,0,Seed Bomb,80,100,15,,
611,9,1,Seed Flare,120,85,5,May lower opponent's Special Defense.,40
612,5,0,Seismic Toss,,100,20,Inflicts damage equal to user's level.,
613,12,0,Self-Destruct,200,100,5,User faints.,
614,8,1,Shadow Ball,80,100,15,May lower opponent's Special Defense.,20
615,8,0,Shadow Bone,85,100,10,May lower opponent's Defense.,20
616,8,0,Shadow Claw,70,100,15,High critical hit ratio.,
617,8,0,Shadow Force,120,100,5,"Disappears on first turn, attacks on second. Can strike through Protect/Detect.",
618,8,0,Shadow Punch,60,,20,Ignores Accuracy and Evasiveness.,
619,8,0,Shadow Sneak,40,100,30,User attacks first.,
620,12,2,Sharpen,,,30,Raises user's Attack.,
621,12,2,Shed Tail,,,10,"Creates a substitute, then swaps places with a party Pokémon in waiting.",
622,11,1,Sheer Cold,,30,5,"One-Hit-KO, if it hits.",
623,13,1,Shell Side Arm,90,100,10,"May poison opponent. Inflicts either Special or Physical damage, whichever is better.",
624,12,2,Shell Smash,,,15,"Sharply raises user's Attack, Special Attack and Speed but lowers Defense and Special Defense.",
625,6,1,Shell Trap,150,100,5,Deals more damage to opponent if hit by a Physical move.,
626,16,2,Shelter,,,10,Raises Defense and Evasion.,
627,16,2,Shift Gear,,,10,Raises user's Attack and sharply raises Speed.,
628,3,1,Shock Wave,60,,20,Ignores Accuracy and Evasiveness.,
629,10,2,Shore Up,,,5,The user regains up to half of its max HP. It restores more HP in a sandstorm.,
630,0,1,Signal Beam,75,100,15,May confuse opponent.,10
631,0,2,Silk Trap,,,10,Protects the user and lowers opponent's Speed on contact.,
632,0,1,Silver Wind,60,100,5,May raise all stats of user at once.,10
633,12,2,Simple Beam,,100,15,Changes target's ability to Simple.,
634,12,2,Sing,,55,15,Puts opponent to sleep.,
635,6,0,Sizzly Slide,90,100,15,Burns the opponent.,100
636,12,2,Sketch,,,1,Permanently copies the opponent's last move.,
637,14,2,Skill Swap,,,10,The user swaps Abilities with the opponent.,
638,0,0,Skitter Smack,70,90,10,Lowers opponent's Sp. Attack.,
639,12,0,Skull Bash,130,100,10,"Raises Defense on first turn, attacks on second.",100
640,7,0,Sky Attack,140,90,5,"Charges on first turn, attacks on second. May cause flinching. High critical hit ratio.",30
641,7,0,Sky Drop,60,100,10,"Takes opponent into the air on first turn, drops them on second turn.",
642,5,0,Sky Uppercut,85,90,15,"Hits the opponent, even during Fly.",
643,12,2,Slack Off,,,5,User recovers half its max HP.,
644,12,0,Slam,80,75,20,,
645,12,0,Slash,70,100,20,High critical hit ratio.,
646,9,2,Sleep Powder,,75,15,Puts opponent to sleep.,
647,12,2,Sleep Talk,,,10,User performs one of its own moves while sleeping.,
648,13,1,Sludge,65,100,20,May poison opponent.,30
649,13,1,Sludge Bomb,90,100,10,May poison opponent.,30
650,13,1,Sludge Wave,95,100,10,May poison opponent.,10
651,15,0,Smack Down,50,100,15,Makes Flying-type Pokémon vulnerable to Ground moves.,100
652,16,0,Smart Strike,70,,10,The user stabs the target with a sharp horn. This attack never misses.,
653,12,0,Smelling Salts,70,100,10,"Power doubles if opponent is paralyzed, but cures it.",
654,13,1,Smog,30,70,20,May poison opponent.,40
655,12,2,Smokescreen,,100,20,Lowers opponent's Accuracy.,
656,9,0,Snap Trap,35,100,15,"Traps opponent, damaging them for 4-5 turns.",100
657,1,1,Snarl,55,95,15,Lowers opponent's Special Attack.,100
658,1,2,Snatch,,,10,Steals the effects of the opponent's next move.,
659,17,1,Snipe Shot,80,100,15,Ignores moves and abilities that draw in moves. High critical hit ratio.,
660,12,1,Snore,50,100,15,Can only be used if asleep. May cause flinching.,30
661,11,2,Snowscape,,,10,Raises Defense of Ice types for 5 turns.,
662,17,2,Soak,,100,20,Changes the target's type to water.,
663,12,2,Soft-Boiled,,,5,User recovers half its max HP.,
664,9,1,Solar Beam,120,100,10,"Charges on first turn, attacks on second.",
665,9,0,Solar Blade,125,100,10,"Charges on first turn, attacks on second.",
666,12,1,Sonic Boom,,90,20,Always inflicts 20 HP.,
667,2,1,Spacial Rend,100,95,5,High critical hit ratio.,
668,3,0,Spark,65,100,20,May paralyze opponent.,30
669,17,1,Sparkling Aria,90,100,10,Heals the burns of its target.,
670,4,1,Sparkly Swirl,90,100,15,Cures all status problems in the party Pokémon.,
671,8,0,Spectral Thief,90,100,10,"The user hides in the target's shadow, steals the target's stat boosts, and then attacks.",
672,14,2,Speed Swap,,,10,The user exchanges Speed stats with the target.,
673,9,2,Spicy Extract,,,15,Harshly lowers the opponent's Defense and sharply raises their Attack.,
674,0,2,Spider Web,,,10,Opponent cannot escape/switch.,
675,12,0,Spike Cannon,20,100,15,Hits 2-5 times in one turn.,
676,10,2,Spikes,,,20,Hurts opponents when they switch into battle.,
677,9,2,Spiky Shield,,,10,Protects the user and inflicts damage on contact.,
678,16,0,Spin Out,100,100,5,Harshly lowers user’s Speed.,
679,4,0,Spirit Break,75,100,15,Lowers opponent's Special Attack.,100
680,8,0,Spirit Shackle,80,100,10,Prevents the opponent from switching out.,
681,12,1,Spit Up,,100,10,Power depends on how many times the user performed Stockpile.,
682,8,2,Spite,,100,10,The opponent's last move loses 2-5 PP.,
683,12,2,Splash,,,40,Doesn't do ANYTHING.,
684,17,1,Splishy Splash,90,100,15,May paralyze opponent.,30
685,9,2,Spore,,100,15,Puts opponent to sleep.,
686,12,2,Spotlight,,,15,The user shines a spotlight on the target so that only the target will be attacked during the turn.,
687,4,1,Springtide Storm,100,80,5,"Boosts user's stats in Incarnate Forme, or lowers opponent's stats in Therian Forme.",
688,15,2,Stealth Rock,,,20,Damages opponent switching into battle.,
689,17,1,Steam Eruption,110,95,5,May burn opponent.,30
690,0,0,Steamroller,65,100,20,May cause flinching.,30
691,16,1,Steel Beam,140,95,5,User loses 50% of its HP.,
692,16,0,Steel Roller,130,100,5,Fails if no Terrain in effect.,
693,16,0,Steel Wing,70,90,25,May raise user's Defense.,10
694,0,2,Sticky Web,,,20,Lowers opponent's Speed when switching into battle.,
695,12,2,Stockpile,,,20,Stores energy for use with Spit Up and Swallow.,
696,12,0,Stomp,65,100,20,May cause flinching.,30
697,10,0,Stomping Tantrum,75,100,10,"Driven by frustration, the user attacks the target. If the user's previous move has failed, the power of this move doubles.",
698,15,0,Stone Axe,65,90,15,High critical hit ratio. Damages target with splinters each turn.,
699,15,0,Stone Edge,100,80,5,High critical hit ratio.,
700,14,1,Stored Power,20,100,10,Power increases when user's stats have been raised.,
701,5,0,Storm Throw,60,100,10,Always results in a critical hit.,100
702,4,1,Strange Steam,90,95,10,May confuse opponent.,20
703,12,0,Strength,80,100,15,,
704,9,2,Strength Sap,,100,10,The user restores its HP by the same amount as the target's Attack stat. It also lowers the target's Attack stat.,100
705,0,2,String Shot,,95,40,Sharply lowers opponent's Speed.,
706,12,0,Struggle,50,,—,Only usable when all PP are gone. Hurts the user.,
707,0,1,Struggle Bug,50,100,20,Lowers opponent's Special Attack.,100
708,12,2,Stuff Cheeks,,,10,"The user eats its held Berry, then sharply raises its Defense stat.",100
709,9,2,Stun Spore,,75,30,Paralyzes opponent.,
710,5,0,Submission,80,80,20,User receives recoil damage.,
711,12,2,Substitute,,,10,Uses HP to creates a decoy that takes hits.,
712,1,0,Sucker Punch,70,100,5,"User attacks first, but only works if opponent is readying an attack.",
713,6,2,Sunny Day,,,5,Makes it sunny for 5 turns.,
714,16,0,Sunsteel Strike,100,100,5,Ignores the target's ability.,
715,12,0,Super Fang,,90,10,Always takes off half of the opponent's HP.,
716,5,0,Superpower,120,100,5,Lowers user's Attack and Defense.,100
717,12,2,Supersonic,,55,20,Confuses opponent.,
718,17,1,Surf,90,100,15,Hits all adjacent Pokémon.,
719,17,0,Surging Strikes,25,100,5,Always results in a critical hit and ignores stat changes.,
720,12,2,Swagger,,85,15,"Confuses opponent, but sharply raises its Attack.",
721,12,2,Swallow,,,10,"The more times the user has performed Stockpile, the more HP is recovered.",
722,4,2,Sweet Kiss,,75,10,Confuses opponent.,
723,12,2,Sweet Scent,,100,20,Lowers opponent's Evasiveness.,
724,12,1,Swift,60,,20,Ignores Accuracy and Evasiveness.,
725,1,2,Switcheroo,,100,10,Swaps held items with the opponent.,
726,12,2,Swords Dance,,,20,Sharply raises user's Attack.,
